{
  "$schema": "./release-automation-policy.schema.json",
  "schemaVersion": 1,
  "enabled": true,
  "repository": "jatmn/Codex-warp-sandbox",
  "baseBranch": "main",
  "headRepository": "jatmn/Codex-warp-sandbox",
  "headRef": "release-please--branches--main--components--codex-warp",
  "appBot": {
    "id": 323326878,
    "login": "codex-warp-sandbox-bot[bot]",
    "type": "Bot"
  },
  "requiredFiles": [
    ".release-please-manifest.json",
    "CHANGELOG.md",
    "Cargo.lock",
    "Cargo.toml"
  ],
  "allowedFiles": [
    ".release-please-manifest.json",
    "CHANGELOG.md",
    "Cargo.lock",
    "Cargo.toml"
  ]
}
